### ISSUE TITLE
Langgenius-email in Dify returns success upon sending email but no email received using maildev

### ISSUE THREAD

**Issue by nemofira09** [langgenius/dify-official-plugins#1690]
### Self Checks

- [x] This is only for bug report, if you would like to ask a question, please head to [Discussions](https://github.com/langgenius/dify/discussions/categories/general).
- [x] I have searched for existing issues [Dify issues](https://github.com/langgenius/dify/issues) & [Dify Official Plugins](https://github.com/langgenius/dify-official-plugins/issues), including closed ones.
- [x] I confirm that I am using English to submit this report (我已阅读并同意 [Language Policy](https://github.com/langgenius/dify/issues/1542)).
- [x] [FOR CHINESE USERS] 请务必使用英文提交 Issue，否则会被关闭。谢谢！:）
- [x] Please do not modify this template :) and fill in all the required fields.

### Dify version

1.7.2

### Plugin version

0.0.7

### Cloud or Self Hosted

Self Hosted (Docker)

### Steps to reproduce

1. Deploy Dify Self-host Community in VM
2. Install MailDev via NPM in the VM
3. Connect Langgenius-email plugin in a workflow and enter credentials

What we've tried:
1. Can curl the 1025 / 1080 ports from another machine within the same network
2. Sent an email manually via swak - Maildev was able to receive the email.

### ✔️ Error log

No error logs generated.
Checked:
1. Docker-plugin_daemon-1
2. Docker-api-1
3. Docker-nginx-1
4. Docker-ssrf_proxy-1
5. Live Maildev logs

No error logs found.

**Comment by nemofira09** [comment]
@dosu

I am using the VM's IP Address since that is where the maildev server is hosted and they are not within the same docker network since maildev is installed directly on the VM not via docker. Within the VM I am able to access via telnet.

**Comment by nemofira09** [comment]
I am able to curl ip_address:1025 of maildev inside docker-plugin_daemon-1.
setting maildev to 0.0.0.0 makes it inaccessible even inside the VM.
The configuration is accurate to the maildev config.
@dosu

**Comment by nemofira09** [comment]
How do I edit the ssrf_proxy config to allow the VM IP as well as the 1025 port. What to input in squid.conf.template.
@dosu

**Comment by nemofira09** [comment]
The ports are all enabled by default upon checking, and adding:
acl allowed_vm dst <YOUR_VM_IP>
http_access allow allowed_vm
Did not work. Still can't send.
@dosu

**Comment by nemofira09** [comment]
@dosu
I've uncommented acl SSL_ports port 1025-65535 and checked the ssrf_proxy-1 container and there are no denied logs, or any errors. How do I confirm if plugin is routing SMTP traffic through the proxy and not bypassing it.

**Comment by nemofira09** [comment]
@dosu
I tried tcdump via:

sudo tcpdump -i any port 1025 -nn

and got the logs:
listening on any, link-type LINUX_SLL2 (Linux cooked v2), snapshot length 262144 bytes
05:14:50.065766 veth1fdcd87 P   IP 172.18.0.9.44192 > 192.168.200.240.1025: Flags [S], seq 2190638644, win 64240, options [mss 1460,sackOK,TS val 1650518111 ecr 0,nop,wscale 7], length 0
05:14:50.065777 br-51d34c30828f In  IP 172.18.0.9.44192 > 192.168.200.240.1025: Flags [S], seq 2190638644, win 64240, options [mss 1460,sackOK,TS val 1650518111 ecr 0,nop,wscale 7], length 0
05:14:50.065910 br-51d34c30828f Out IP 192.168.200.240.1025 > 172.18.0.9.44192: Flags [S.], seq 639284647, ack 2190638645, win 65160, options [mss 1460,sackOK,TS val 2075721432 ecr 1650518111,nop,wscale 7], length 0
05:14:50.065921 veth1fdcd87 Out IP 192.168.200.240.1025 > 172.18.0.9.44192: Flags [S.], seq 639284647, ack 2190638645, win 65160, options [mss 1460,sackOK,TS val 2075721432 ecr 1650518111,nop,wscale 7], length 0
05:14:50.065994 veth1fdcd87 P   IP 172.18.0.9.44192 > 192.168.200.240.1025: Flags [.], ack 1, win 502, options [nop,nop,TS val 1650518111 ecr 2075721432], length 0
05:14:50.065999 br-51d34c30828f In  IP 172.18.0.9.44192 > 192.168.200.240.1025: Flags [.], ack 1, win 502, options [nop,nop,TS val 1650518111 ecr 2075721432], length 0
05:14:50.177747 br-51d34c30828f Out IP 192.168.200.240.1025 > 172.18.0.9.44192: Flags [P.], seq 1:23, ack 1, win 510, options [nop,nop,TS val 2075721544 ecr 1650518111], length 22
05:14:50.177764 veth1fdcd87 Out IP 192.168.200.240.1025 > 172.18.0.9.44192: Flags [P.], seq 1:23, ack 1, win 510, options [nop,nop,TS val 2075721544 ecr 1650518111], length 22
05:14:50.177853 veth1fdcd87 P   IP 172.18.0.9.44192 > 192.168.200.240.1025: Flags [.], ack 23, win 502, options [nop,nop,TS val 1650518223 ecr 2075721544], length 0
05:14:50.177860 br-51d34c30828f In  IP 172.18.0.9.44192 > 192.168.200.240.1025: Flags [.], ack 23, win 502, options [nop,nop,TS val 1650518223 ecr 2075721544], length 0
05:14:50.179689 veth1fdcd87 P   IP 172.18.0.9.44192 > 192.168.200.240.1025: Flags [P.], seq 1:20, ack 23, win 502, options [nop,nop,TS val 1650518225 ecr 2075721544], length 19
05:14:50.179695 br-51d34c30828f In  IP 172.18.0.9.44192 > 192.168.200.240.1025: Flags [P.], seq 1:20, ack 23, win 502, options [nop,nop,TS val 1650518225 ecr 2075721544], length 19
05:14:50.179756 br-51d34c30828f Out IP 192.168.200.240.1025 > 172.18.0.9.44192: Flags [.], ack 20, win 510, options [nop,nop,TS val 2075721546 ecr 1650518225], length 0
05:14:50.179763 veth1fdcd87 Out IP 192.168.200.240.1025 > 172.18.0.9.44192: Flags [.], ack 20, win 510, options [nop,nop,TS val 2075721546 ecr 1650518225], length 0
05:14:50.180552 br-51d34c30828f Out IP 192.168.200.240.1025 > 172.18.0.9.44192: Flags [P.], seq 23:114, ack 20, win 510, options [nop,nop,TS val 2075721547 ecr 1650518225], length 91
05:14:50.180564 veth1fdcd87 Out IP 192.168.200.240.1025 > 172.18.0.9.44192: Flags [P.], seq 23:114, ack 20, win 510, options [nop,nop,TS val 2075721547 ecr 1650518225], length 91
05:14:50.180913 veth1fdcd87 P   IP 172.18.0.9.44192 > 192.168.200.240.1025: Flags [P.], seq 20:26, ack 114, win 502, options [nop,nop,TS val 1650518226 ecr 2075721547], length 6
05:14:50.180919 br-51d34c30828f In  IP 172.18.0.9.44192 > 192.168.200.240.1025: Flags [P.], seq 20:26, ack 114, win 502, options [nop,nop,TS val 1650518226 ecr 2075721547], length 6
05:14:50.181414 br-51d34c30828f Out IP 192.168.200.240.1025 > 172.18.0.9.44192: Flags [P.], seq 114:123, ack 26, win 510, options [nop,nop,TS val 2075721548 ecr 1650518226], length 9
05:14:50.181425 veth1fdcd87 Out IP 192.168.200.240.1025 > 172.18.0.9.44192: Flags [P.], seq 114:123, ack 26, win 510, options [nop,nop,TS val 2075721548 ecr 1650518226], length 9
05:14:50.181697 veth1fdcd87 P   IP 172.18.0.9.44192 > 192.168.200.240.1025: Flags [F.], seq 26, ack 123, win 502, options [nop,nop,TS val 1650518227 ecr 2075721548], length 0
05:14:50.181702 br-51d34c30828f In  IP 172.18.0.9.44192 > 192.168.200.240.1025: Flags [F.], seq 26, ack 123, win 502, options [nop,nop,TS val 1650518227 ecr 2075721548], length 0
05:14:50.181841 br-51d34c30828f Out IP 192.168.200.240.1025 > 172.18.0.9.44192: Flags [F.], seq 123, ack 27, win 510, options [nop,nop,TS val 2075721548 ecr 1650518227], length 0
05:14:50.181850 veth1fdcd87 Out IP 192.168.200.240.1025 > 172.18.0.9.44192: Flags [F.], seq 123, ack 27, win 510, options [nop,nop,TS val 2075721548 ecr 1650518227], length 0
05:14:50.181909 veth1fdcd87 P   IP 172.18.0.9.44192 > 192.168.200.240.1025: Flags [.], ack 124, win 502, options [nop,nop,TS val 1650518227 ecr 2075721548], length 0
05:14:50.181913 br-51d34c30828f In  IP 172.18.0.9.44192 > 192.168.200.240.1025: Flags [.], ack 124, win 502, options [nop,nop,TS val 1650518227 ecr 2075721548], length 0

**Comment by nemofira09** [comment]
SMTP config is set to none, but I cannot set the username and password because it is a required field in the langgenius-email field. The port is set to 1025. I am unable to test within the container because the necessary tools aren't installed, and it is not connected to the internet.
@dosu

**Comment by nemofira09** [comment]
Finally solved it.
Turns out that you just need to use the --incoming-user and --incoming-pass flags when running maildev, and the values should match the email username and email password you typed in the langgenius-email form.
